{
  "spec_version": "1.0",
  "analysis_id": "panel-dual-table",
  "input": {"path": "/absolute/path/panel.dta", "format": "auto", "id": "person_id", "time": "wave"},
  "analysis": {"group": "exposure_group", "panel_mode": "dual", "subset": null, "note": "Primary tables are wave-specific; pooled results are compatibility evidence only."},
  "blocks": [
    {"id": "dv", "label": "被解释变量", "variables": [
      {"name": "outcome", "type": "continuous", "method": "normal", "digits": 3, "label": null, "include_missing": false, "reference": null, "levels": null}
    ]}
  ],
  "display": {"show_all": true, "show_n": true, "show_p_overall": true, "show_p_multiple": false, "show_p_trend": false, "p_digits": 3, "compatibility_export2word": false},
  "outputs": {"stem": "Table_panel", "formats": ["docx", "csv", "rds"]}
}
